{
    "$id": "https://sdlc.ai/schemas/security-report.schema.json",
    "$schema": "http://json-schema.org/draft-07/schema#",
    "title": "Security Report",
    "description": "Output of the Phase 3 threat modeling process.",
    "type": "object",
    "additionalProperties": false,
    "required": [
        "phase",
        "risk_score",
        "threat_model",
        "auth_review"
    ],
    "properties": {
        "phase": {
            "type": "string",
            "const": "security"
        },
        "risk_score": {
            "type": "string",
            "enum": [
                "LOW",
                "MEDIUM",
                "HIGH",
                "CRITICAL"
            ]
        },
        "threat_model": {
            "type": "array",
            "items": {
                "type": "object",
                "additionalProperties": false,
                "required": [
                    "threat",
                    "mitigation",
                    "status"
                ],
                "properties": {
                    "threat": {
                        "type": "string"
                    },
                    "mitigation": {
                        "type": "string"
                    },
                    "status": {
                        "type": "string",
                        "enum": [
                            "MITIGATED",
                            "ACCEPTED",
                            "OPEN"
                        ]
                    }
                }
            }
        },
        "auth_review": {
            "type": "object",
            "additionalProperties": false,
            "required": [
                "new_permissions",
                "sensitive_data_exposure"
            ],
            "properties": {
                "new_permissions": {
                    "type": "boolean"
                },
                "sensitive_data_exposure": {
                    "type": "boolean"
                }
            }
        }
    }
}