{
    "phase": "security",
    "risk_score": "LOW",
    "threat_model": [
        {
            "threat": "Token Hijacking",
            "mitigation": "Short expiry time (30m) + HTTPS",
            "status": "MITIGATED"
        },
        {
            "threat": "Weak Secrets",
            "mitigation": "Load from environment variable",
            "status": "MITIGATED"
        }
    ],
    "auth_review": {
        "new_permissions": true,
        "sensitive_data_exposure": false
    }
}